{
  "$schema": "https://json-schema.org/draft/2020-12/schema",
  "$id": "https://github.com/scriptorium-suite/scriptorium-spec/blob/main/schemas/reading-note/v1.json",
  "title": "Scriptorium Reading Note v1",
  "description": "A per-paper staged interpretation produced by the read-paper agent task as you read at the depth you need. The four OPTIONAL stages are glance / close_read / deep_read / situate, each filled on demand. Joined to the rest of the suite by `id` = the Better BibTeX citekey. Steward can render it to Markdown; Obsidian is an optional client. Direct Provenance ingestion is a Public Alpha release gap, not a shipped consumer. Additive contract — supersedes nothing. See specs/literature-reading.md §3.",
  "type": "object",
  "required": ["schema_version", "id", "created"],
  "properties": {
    "schema_version": { "const": "reading-note/1.0" },
    "id": {
      "type": "string",
      "description": "Better BibTeX citekey — the universal join id across the suite (library-kb, lineage, project linked_literature)."
    },
    "zotero_key": {
      "type": "string",
      "pattern": "^[A-Z0-9]{8}$",
      "description": "Zotero item key, if known (same shape as library-kb item keys)."
    },
    "doi": { "type": "string", "description": "DOI of the paper, if known." },
    "read_status": {
      "type": "string",
      "enum": ["New", "To Read", "In Progress", "Read", "Not Reading"],
      "description": "Reading progress, mirrors the zotero-reading-list plugin states; the read-paper skill bumps this as depth advances."
    },
    "created": { "type": "string", "description": "ISO 8601 date or date-time when the note was first created." },
    "generated_by": { "type": "string", "description": "Producer tag, e.g. the read-paper skill + agent." },
    "stages": {
      "type": "object",
      "description": "The four reading levels. Each stage is OPTIONAL and filled on demand as you read deeper.",
      "properties": {
        "glance": {
          "type": "object",
          "description": "速览 — fast orientation, seeded from library-kb.",
          "properties": {
            "tldr": { "type": "string" },
            "tags": { "type": "array", "items": { "type": "string" } },
            "key_findings": { "type": "array", "items": { "type": "string" } }
          }
        },
        "close_read": {
          "type": "object",
          "description": "精读 — full-text read against the parsed sections + your annotations.",
          "properties": {
            "question": { "type": "string" },
            "method": { "type": "string" },
            "data": { "type": "string" },
            "results": { "type": "string" },
            "figures": { "type": "array", "items": { "type": "string" } }
          }
        },
        "deep_read": {
          "type": "object",
          "description": "深度审读 — critique + relation to your own work (uses Provenance memory).",
          "properties": {
            "critique": { "type": "string" },
            "reproducibility": { "type": "string" },
            "limits": { "type": "string" },
            "relation_to_my_work": { "type": "string" }
          }
        },
        "situate": {
          "type": "object",
          "description": "串联定位 — place the paper in its research-direction lineage.",
          "properties": {
            "direction": { "type": "string" },
            "lineage_refs": {
              "type": "array",
              "items": { "type": "string" },
              "description": "Citekeys of related papers in the lineage."
            }
          }
        }
      }
    },
    "sources": {
      "type": "object",
      "description": "Provenance of the evidence the stages are built from (anti-fabrication: figures/data/citations reference these, never invented).",
      "properties": {
        "annotations": {
          "type": "array",
          "items": { "type": "string" },
          "description": "PDF++ / Zotero annotation references (markdown / Zotero API)."
        },
        "parsed_file": { "type": "string", "description": "Path to the GROBID/MinerU-parsed structured file." },
        "zotero_uri": { "type": "string", "description": "Zotero item URI." }
      }
    }
  }
}
